CWE-ID,Name,Weakness Abstraction,Status,Description,Extended Description,Related Weaknesses,Weakness Ordinalities,Applicable Platforms,Background Details,Alternate Terms,Modes Of Introduction,Exploitation Factors,Likelihood of Exploit,Common Consequences,Detection Methods,Potential Mitigations,Observed Examples,Functional Areas,Affected Resources,Taxonomy Mappings,Related Attack Patterns,Notes
364,"Signal Handler Race Condition",Base,Incomplete,"The product uses a signal handler that introduces a race condition.","Race conditions frequently occur in signal handlers, since signal handlers support asynchronous actions. These race conditions have a variety of root causes and symptoms. Attackers may be able to exploit a signal handler race condition to cause the product state to be corrupted, possibly leading to a denial of service or even code execution. These issues occur when non-reentrant functions, or state-sensitive actions occur in the signal handler, where they may be called at any time. These behaviors can violate assumptions being made by the regular code that is interrupted, or by other signal handlers that may also be invoked. If these functions are called at an inopportune moment - such as while a non-reentrant function is already running - memory corruption could occur that may be exploitable for code execution. Another signal race condition commonly found occurs when free is called within a signal handler, resulting in a double free and therefore a write-what-where condition. Even if a given pointer is set to NULL after it has been freed, a race condition still exists between the time the memory was freed and the pointer was set to NULL. This is especially problematic if the same signal handler has been set for more than one signal -- since it means that the signal handler itself may be reentered. There are several known behaviors related to signal handlers that have received the label of signal handler race condition: Shared state (e.g. global data or static variables) that are accessible to both a signal handler and regular code Shared state between a signal handler and other signal handlers Use of non-reentrant functionality within a signal handler - which generally implies that shared state is being used. For example, malloc() and free() are non-reentrant because they may use global or static data structures for managing memory, and they are indirectly used by innocent-seeming functions such as syslog(); these functions could be exploited for memory corruption and, possibly, code execution. Association of the same signal handler function with multiple signals - which might imply shared state, since the same code and resources are accessed. For example, this can be a source of double-free and use-after-free weaknesses. Use of setjmp and longjmp, or other mechanisms that prevent a signal handler from returning control back to the original functionality While not technically a race condition, some signal handlers are designed to be called at most once, and being called more than once can introduce security problems, even when there are not any concurrent calls to the signal handler. This can be a source of double-free and use-after-free weaknesses. Signal handler vulnerabilities are often classified based on the absence of a specific protection mechanism, although this style of classification is discouraged in CWE because programmers often have a choice of several different mechanisms for addressing the weakness. Such protection mechanisms may preserve exclusivity of access to the shared resource, and behavioral atomicity for the relevant code: Avoiding shared state Using synchronization in the signal handler Using synchronization in the regular code Disabling or masking other signals, which provides atomicity (which effectively ensures exclusivity)",::NATURE:ChildOf:CWE ID:362:VIEW ID:1000:ORDINAL:Primary::NATURE:CanPrecede:CWE ID:415:VIEW ID:1000::NATURE:CanPrecede:CWE ID:416:VIEW ID:1000::NATURE:CanPrecede:CWE ID:123:VIEW ID:1000::,"",::LANGUAGE NAME:C:LANGUAGE PREVALENCE:Sometimes::LANGUAGE NAME:C++:LANGUAGE PREVALENCE:Sometimes::,"","","::PHASE:Implementation::","",,"::SCOPE:Integrity:SCOPE:Confidentiality:SCOPE:Availability:IMPACT:Modify Application Data:IMPACT:Modify Memory:IMPACT:DoS: Crash, Exit, or Restart:IMPACT:Execute Unauthorized Code or Commands:NOTE:It may be possible to cause data corruption and possibly execute arbitrary code by modifying global variables or data structures at unexpected times, violating the assumptions of code that uses this global data.::SCOPE:Access Control:IMPACT:Gain Privileges or Assume Identity:NOTE:If a signal handler interrupts code that is executing with privileges, it may be possible that the signal handler will also be executed with elevated privileges, possibly making subsequent exploits more severe.::","","::PHASE:Requirements:STRATEGY:Language Selection:DESCRIPTION:Use a language that does not allow this weakness to occur or provides constructs that make this weakness easier to avoid.::PHASE:Architecture and Design:DESCRIPTION:Design signal handlers to only set flags, rather than perform complex functionality. These flags can then be checked and acted upon within the main program loop.::PHASE:Implementation:DESCRIPTION:Only use reentrant functions within signal handlers. Also, use validation to ensure that state is consistent while performing asynchronous actions that affect the state of execution.::","::REFERENCE:CVE-1999-0035:DESCRIPTION:Signal handler does not disable other signal handlers, allowing it to be interrupted, causing other functionality to access files/etc. with raised privileges:LINK:https://www.cve.org/CVERecord?id=CVE-1999-0035::REFERENCE:CVE-2001-0905:DESCRIPTION:Attacker can send a signal while another signal handler is already running, leading to crash or execution with root privileges:LINK:https://www.cve.org/CVERecord?id=CVE-2001-0905::REFERENCE:CVE-2001-1349:DESCRIPTION:unsafe calls to library functions from signal handler:LINK:https://www.cve.org/CVERecord?id=CVE-2001-1349::REFERENCE:CVE-2004-0794:DESCRIPTION:SIGURG can be used to remotely interrupt signal handler; other variants exist:LINK:https://www.cve.org/CVERecord?id=CVE-2004-0794::REFERENCE:CVE-2004-2259:DESCRIPTION:SIGCHLD signal to FTP server can cause crash under heavy load while executing non-reentrant functions like malloc/free.:LINK:https://www.cve.org/CVERecord?id=CVE-2004-2259::",::Signals::Interprocess Communication::,::System Process::,"::TAXONOMY NAME:PLOVER:ENTRY NAME:Signal handler race condition::TAXONOMY NAME:7 Pernicious Kingdoms:ENTRY NAME:Signal Handling Race Conditions::TAXONOMY NAME:CLASP:ENTRY NAME:Race condition in signal handler::TAXONOMY NAME:Software Fault Patterns:ENTRY ID:SFP19:ENTRY NAME:Missing Lock::",,"",
367,"Time-of-check Time-of-use (TOCTOU) Race Condition",Base,Incomplete,"The product checks the state of a resource before using that resource, but the resource's state can change between the check and the use in a way that invalidates the results of the check. This can cause the product to perform invalid actions when the resource is in an unexpected state.","This weakness can be security-relevant when an attacker can influence the state of the resource between check and use. This can happen with shared resources such as files, memory, or even variables in multithreaded programs.",::NATURE:ChildOf:CWE ID:362:VIEW ID:1000:ORDINAL:Primary::NATURE:ChildOf:CWE ID:362:VIEW ID:1003:ORDINAL:Primary::,"",::LANGUAGE CLASS:Not Language-Specific:LANGUAGE PREVALENCE:Undetermined::,"","::TERM:TOCTTOU:DESCRIPTION:The TOCTTOU acronym expands to Time Of Check To Time Of Use.::TERM:TOCCTOU:DESCRIPTION:The TOCCTOU acronym is most likely a typo of TOCTTOU, but it has been used in some influential documents, so the typo is repeated fairly frequently.::","::PHASE:Implementation::","",,"::SCOPE:Integrity:SCOPE:Other:IMPACT:Alter Execution Logic:IMPACT:Unexpected State:NOTE:The attacker can gain access to otherwise unauthorized resources.::SCOPE:Integrity:SCOPE:Other:IMPACT:Modify Application Data:IMPACT:Modify Files or Directories:IMPACT:Modify Memory:IMPACT:Other:NOTE:Race conditions such as this kind may be employed to gain read or write access to resources which are not normally readable or writable by the user in question.::SCOPE:Integrity:SCOPE:Other:IMPACT:Other:NOTE:The resource in question, or other resources (through the corrupted one), may be changed in undesirable ways by a malicious user.::SCOPE:Non-Repudiation:IMPACT:Hide Activities:NOTE:If a file or other resource is written in this method, as opposed to in a valid way, logging of the activity may not occur.::SCOPE:Non-Repudiation:SCOPE:Other:IMPACT:Other:NOTE:In some cases it may be possible to delete files a malicious user might not otherwise have access to, such as log files.::","::METHOD:Automated Static Analysis:DESCRIPTION:Automated static analysis, commonly referred to as Static Application Security Testing (SAST), can find some instances of this weakness by analyzing source code (or binary/compiled code) without having to execute it. Typically, this is done by building a model of data flow and control flow, then searching for potentially-vulnerable patterns that connect sources (origins of input) with sinks (destinations where the data interacts with external components, a lower layer such as the OS, etc.):EFFECTIVENESS:High::","::PHASE:Implementation:DESCRIPTION:The most basic advice for TOCTOU vulnerabilities is to not perform a check before the use. This does not resolve the underlying issue of the execution of a function on a resource whose state and identity cannot be assured, but it does help to limit the false sense of security given by the check.::PHASE:Implementation:DESCRIPTION:When the file being altered is owned by the current user and group, set the effective gid and uid to that of the current user and group when executing this statement.::PHASE:Architecture and Design:DESCRIPTION:Limit the interleaving of operations on files from multiple processes.::PHASE:Implementation Architecture and Design:DESCRIPTION:If you cannot perform operations atomically and you must share access to the resource between multiple processes or threads, then try to limit the amount of time (CPU cycles) between the check and use of the resource. This will not fix the problem, but it could make it more difficult for an attack to succeed.::PHASE:Implementation:DESCRIPTION:Recheck the resource after the use call to verify that the action was taken appropriately.::PHASE:Architecture and Design:DESCRIPTION:Ensure that some environmental locking mechanism can be used to protect resources effectively.::PHASE:Implementation:DESCRIPTION:Ensure that locking occurs before the check, as opposed to afterwards, such that the resource, as checked, is the same as it is when in use.::","::REFERENCE:CVE-2015-1743:DESCRIPTION:TOCTOU in sandbox process allows installation of untrusted browser add-ons by replacing a file after it has been verified, but before it is executed:LINK:https://www.cve.org/CVERecord?id=CVE-2015-1743::REFERENCE:CVE-2003-0813:DESCRIPTION:A multi-threaded race condition allows remote attackers to cause a denial of service (crash or reboot) by causing two threads to process the same RPC request, which causes one thread to use memory after it has been freed.:LINK:https://www.cve.org/CVERecord?id=CVE-2003-0813::REFERENCE:CVE-2004-0594:DESCRIPTION:PHP flaw allows remote attackers to execute arbitrary code by aborting execution before the initialization of key data structures is complete.:LINK:https://www.cve.org/CVERecord?id=CVE-2004-0594::REFERENCE:CVE-2008-2958:DESCRIPTION:chain: time-of-check time-of-use (TOCTOU) race condition in program allows bypass of protection mechanism that was designed to prevent symlink attacks.:LINK:https://www.cve.org/CVERecord?id=CVE-2008-2958::REFERENCE:CVE-2008-1570:DESCRIPTION:chain: time-of-check time-of-use (TOCTOU) race condition in program allows bypass of protection mechanism that was designed to prevent symlink attacks.:LINK:https://www.cve.org/CVERecord?id=CVE-2008-1570::",,,"::TAXONOMY NAME:PLOVER:ENTRY NAME:Time-of-check Time-of-use race condition::TAXONOMY NAME:7 Pernicious Kingdoms:ENTRY NAME:File Access Race Conditions: TOCTOU::TAXONOMY NAME:CLASP:ENTRY NAME:Time of check, time of use race condition::TAXONOMY NAME:CLASP:ENTRY NAME:Race condition in switch::TAXONOMY NAME:CERT C Secure Coding:ENTRY ID:FIO01-C:ENTRY NAME:Be careful using functions that use file names for identification::TAXONOMY NAME:Software Fault Patterns:ENTRY ID:SFP20:ENTRY NAME:Race Condition Window::",::27::29::,"::TYPE:Relationship:NOTE:TOCTOU issues do not always involve symlinks, and not every symlink issue is a TOCTOU problem.::TYPE:Research Gap:NOTE:Non-symlink TOCTOU issues are not reported frequently, but they are likely to occur in code that attempts to be secure.::",
377,"Insecure Temporary File",Class,Incomplete,"Creating and using insecure temporary files can leave application and system data vulnerable to attack.","",::NATURE:ChildOf:CWE ID:668:VIEW ID:1000:ORDINAL:Primary::,"",::LANGUAGE CLASS:Not Language-Specific:LANGUAGE PREVALENCE:Undetermined::,"","","::PHASE:Implementation::","",,"::SCOPE:Confidentiality:SCOPE:Integrity:IMPACT:Read Files or Directories:IMPACT:Modify Files or Directories::","::METHOD:Automated Static Analysis:DESCRIPTION:Automated static analysis, commonly referred to as Static Application Security Testing (SAST), can find some instances of this weakness by analyzing source code (or binary/compiled code) without having to execute it. Typically, this is done by building a model of data flow and control flow, then searching for potentially-vulnerable patterns that connect sources (origins of input) with sinks (destinations where the data interacts with external components, a lower layer such as the OS, etc.):EFFECTIVENESS:High::","","::REFERENCE:CVE-2022-41954:DESCRIPTION:A library uses the Java File.createTempFile() method which creates a file with -rw-r--r-- default permissions on Unix-like operating systems:LINK:https://www.cve.org/CVERecord?id=CVE-2022-41954::",,,"::TAXONOMY NAME:7 Pernicious Kingdoms:ENTRY NAME:Insecure Temporary File::TAXONOMY NAME:CERT C Secure Coding:ENTRY ID:CON33-C:ENTRY NAME:Avoid race conditions when using library functions:MAPPING FIT:Imprecise::TAXONOMY NAME:The CERT Oracle Secure Coding Standard for Java (2011):ENTRY ID:FIO00-J:ENTRY NAME:Do not operate on files in shared directories::",::149::155::,"::TYPE:Other:NOTE:Applications require temporary files so frequently that many different mechanisms exist for creating them in the C Library and Windows(R) API. Most of these functions are vulnerable to various forms of attacks. The functions designed to aid in the creation of temporary files can be broken into two groups based whether they simply provide a filename or actually open a new file. - Group 1: Unique Filenames: The first group of C Library and WinAPI functions designed to help with the process of creating temporary files do so by generating a unique file name for a new temporary file, which the program is then supposed to open. This group includes C Library functions like tmpnam(), tempnam(), mktemp() and their C++ equivalents prefaced with an _ (underscore) as well as the GetTempFileName() function from the Windows API. This group of functions suffers from an underlying race condition on the filename chosen. Although the functions guarantee that the filename is unique at the time it is selected, there is no mechanism to prevent another process or an attacker from creating a file with the same name after it is selected but before the application attempts to open the file. Beyond the risk of a legitimate collision caused by another call to the same function, there is a high probability that an attacker will be able to create a malicious collision because the filenames generated by these functions are not sufficiently randomized to make them difficult to guess. If a file with the selected name is created, then depending on how the file is opened the existing contents or access permissions of the file may remain intact. If the existing contents of the file are malicious in nature, an attacker may be able to inject dangerous data into the application when it reads data back from the temporary file. If an attacker pre-creates the file with relaxed access permissions, then data stored in the temporary file by the application may be accessed, modified or corrupted by an attacker. On Unix based systems an even more insidious attack is possible if the attacker pre-creates the file as a link to another important file. Then, if the application truncates or writes data to the file, it may unwittingly perform damaging operations for the attacker. This is an especially serious threat if the program operates with elevated permissions. Finally, in the best case the file will be opened with the a call to open() using the O_CREAT and O_EXCL flags or to CreateFile() using the CREATE_NEW attribute, which will fail if the file already exists and therefore prevent the types of attacks described above. However, if an attacker is able to accurately predict a sequence of temporary file names, then the application may be prevented from opening necessary temporary storage causing a denial of service (DoS) attack. This type of attack would not be difficult to mount given the small amount of randomness used in the selection of the filenames generated by these functions. - Group 2: Unique Files: The second group of C Library functions attempts to resolve some of the security problems related to temporary files by not only generating a unique file name, but also opening the file. This group includes C Library functions like tmpfile() and its C++ equivalents prefaced with an _ (underscore), as well as the slightly better-behaved C Library function mkstemp(). The tmpfile() style functions construct a unique filename and open it in the same way that fopen() would if passed the flags wb+, that is, as a binary file in read/write mode. If the file already exists, tmpfile() will truncate it to size zero, possibly in an attempt to assuage the security concerns mentioned earlier regarding the race condition that exists between the selection of a supposedly unique filename and the subsequent opening of the selected file. However, this behavior clearly does not solve the function's security problems. First, an attacker can pre-create the file with relaxed access-permissions that will likely be retained by the file opened by tmpfile(). Furthermore, on Unix based systems if the attacker pre-creates the file as a link to another important file, the application may use its possibly elevated permissions to truncate that file, thereby doing damage on behalf of the attacker. Finally, if tmpfile() does create a new file, the access permissions applied to that file will vary from one operating system to another, which can leave application data vulnerable even if an attacker is unable to predict the filename to be used in advance. Finally, mkstemp() is a reasonably safe way create temporary files. It will attempt to create and open a unique file based on a filename template provided by the user combined with a series of randomly generated characters. If it is unable to create such a file, it will fail and return -1. On modern systems the file is opened using mode 0600, which means the file will be secure from tampering unless the user explicitly changes its access permissions. However, mkstemp() still suffers from the use of predictable file names and can leave an application vulnerable to denial of service attacks if an attacker causes mkstemp() to fail by predicting and pre-creating the filenames to be used.::",
382,"J2EE Bad Practices: Use of System.exit()",Variant,Draft,"A J2EE application uses System.exit(), which also shuts down its container.","It is never a good idea for a web application to attempt to shut down the application container. Access to a function that can shut down the application is an avenue for Denial of Service (DoS) attacks.",::NATURE:ChildOf:CWE ID:705:VIEW ID:1000:ORDINAL:Primary::,"",::LANGUAGE NAME:Java:LANGUAGE PREVALENCE:Undetermined::,"","","::PHASE:Implementation:NOTE:A call to System.exit() is probably part of leftover debug code or code imported from a non-J2EE application.::","",,"::SCOPE:Availability:IMPACT:DoS: Crash, Exit, or Restart::","::METHOD:Automated Static Analysis:DESCRIPTION:Automated static analysis, commonly referred to as Static Application Security Testing (SAST), can find some instances of this weakness by analyzing source code (or binary/compiled code) without having to execute it. Typically, this is done by building a model of data flow and control flow, then searching for potentially-vulnerable patterns that connect sources (origins of input) with sinks (destinations where the data interacts with external components, a lower layer such as the OS, etc.):EFFECTIVENESS:High::","::PHASE:Architecture and Design:STRATEGY:Separation of Privilege:DESCRIPTION:The shutdown function should be a privileged function available only to a properly authorized administrative user::PHASE:Implementation:DESCRIPTION:Web applications should not call methods that cause the virtual machine to exit, such as System.exit()::PHASE:Implementation:DESCRIPTION:Web applications should also not throw any Throwables to the application server as this may adversely affect the container.::PHASE:Implementation:DESCRIPTION:Non-web applications may have a main() method that contains a System.exit(), but generally should not call System.exit() from other locations in the code::","",,,"::TAXONOMY NAME:7 Pernicious Kingdoms:ENTRY NAME:J2EE Bad Practices: System.exit()::TAXONOMY NAME:OWASP Top Ten 2004:ENTRY ID:A9:ENTRY NAME:Denial of Service:MAPPING FIT:CWE More Specific::TAXONOMY NAME:The CERT Oracle Secure Coding Standard for Java (2011):ENTRY ID:ERR09-J:ENTRY NAME:Do not allow untrusted code to terminate the JVM::TAXONOMY NAME:Software Fault Patterns:ENTRY ID:SFP3:ENTRY NAME:Use of an improper API::",,"",
383,"J2EE Bad Practices: Direct Use of Threads",Variant,Draft,"Thread management in a Web application is forbidden in some circumstances and is always highly error prone.","Thread management in a web application is forbidden by the J2EE standard in some circumstances and is always highly error prone. Managing threads is difficult and is likely to interfere in unpredictable ways with the behavior of the application container. Even without interfering with the container, thread management usually leads to bugs that are hard to detect and diagnose like deadlock, race conditions, and other synchronization errors.",::NATURE:ChildOf:CWE ID:695:VIEW ID:1000:ORDINAL:Primary::,"",::LANGUAGE NAME:Java:LANGUAGE PREVALENCE:Undetermined::,"","","::PHASE:Implementation::","",,"::SCOPE:Other:IMPACT:Quality Degradation::","::METHOD:Automated Static Analysis:DESCRIPTION:Automated static analysis, commonly referred to as Static Application Security Testing (SAST), can find some instances of this weakness by analyzing source code (or binary/compiled code) without having to execute it. Typically, this is done by building a model of data flow and control flow, then searching for potentially-vulnerable patterns that connect sources (origins of input) with sinks (destinations where the data interacts with external components, a lower layer such as the OS, etc.):EFFECTIVENESS:High::","::PHASE:Architecture and Design:DESCRIPTION:For EJB, use framework approaches for parallel execution, instead of using threads.::","",,::System Process::,"::TAXONOMY NAME:7 Pernicious Kingdoms:ENTRY NAME:J2EE Bad Practices: Threads::TAXONOMY NAME:Software Fault Patterns:ENTRY ID:SFP3:ENTRY NAME:Use of an improper API::",,"",
