CWE-ID,Name,Weakness Abstraction,Status,Description,Extended Description,Related Weaknesses,Weakness Ordinalities,Applicable Platforms,Background Details,Alternate Terms,Modes Of Introduction,Exploitation Factors,Likelihood of Exploit,Common Consequences,Detection Methods,Potential Mitigations,Observed Examples,Functional Areas,Affected Resources,Taxonomy Mappings,Related Attack Patterns,Notes
103,"Struts: Incomplete validate() Method Definition",Variant,Draft,"The product has a validator form that either does not define a validate() method, or defines a validate() method but does not call super.validate().","If the code does not call super.validate(), the Validation Framework cannot check the contents of the form against a validation form. In other words, the validation framework will be disabled for the given form.",::NATURE:ChildOf:CWE ID:573:VIEW ID:1000:ORDINAL:Primary::NATURE:ChildOf:CWE ID:20:VIEW ID:700:ORDINAL:Primary::,"::ORDINALITY:Primary::",::LANGUAGE NAME:Java:LANGUAGE PREVALENCE:Undetermined::,"::The Struts Validator uses a form's validate() method to check the contents of the form properties against the constraints specified in the associated validation form. That means the following classes have a validate() method that is part of the validation framework: ValidatorForm, ValidatorActionForm, DynaValidatorForm, and DynaValidatorActionForm. If the code creates a class that extends one of these classes, and if that class implements custom validation logic by overriding the validate() method, the code must call super.validate() in the validate() implementation.::","","::PHASE:Implementation::","",,"::SCOPE:Other:IMPACT:Other:NOTE:Disabling the validation framework for a form exposes the product to numerous types of attacks. Unchecked input is the root cause of vulnerabilities like cross-site scripting, process control, and SQL injection.::SCOPE:Confidentiality:SCOPE:Integrity:SCOPE:Availability:SCOPE:Other:IMPACT:Other:NOTE:Although J2EE applications are not generally susceptible to memory corruption attacks, if a J2EE application interfaces with native code that does not perform array bounds checking, an attacker may be able to use an input validation mistake in the J2EE application to launch a buffer overflow attack.::","::METHOD:Automated Static Analysis:DESCRIPTION:Automated static analysis, commonly referred to as Static Application Security Testing (SAST), can find some instances of this weakness by analyzing source code (or binary/compiled code) without having to execute it. Typically, this is done by building a model of data flow and control flow, then searching for potentially-vulnerable patterns that connect sources (origins of input) with sinks (destinations where the data interacts with external components, a lower layer such as the OS, etc.):EFFECTIVENESS:High::","::PHASE:Implementation:DESCRIPTION:Implement the validate() method and call super.validate() within that method.::","",,,"::TAXONOMY NAME:7 Pernicious Kingdoms:ENTRY NAME:Struts: Erroneous validate() Method::TAXONOMY NAME:Software Fault Patterns:ENTRY ID:SFP24:ENTRY NAME:Tainted input to command::",,"::TYPE:Relationship:NOTE:This could introduce other weaknesses related to missing input validation.::TYPE:Maintenance:NOTE:The current description implies a loose composite of two separate weaknesses, so this node might need to be split or converted into a low-level category.::",
104,"Struts: Form Bean Does Not Extend Validation Class",Variant,Draft,"If a form bean does not extend an ActionForm subclass of the Validator framework, it can expose the application to other weaknesses related to insufficient input validation.","",::NATURE:ChildOf:CWE ID:573:VIEW ID:1000:ORDINAL:Primary::NATURE:ChildOf:CWE ID:20:VIEW ID:700:ORDINAL:Primary::,"::ORDINALITY:Primary::",::LANGUAGE NAME:Java:LANGUAGE PREVALENCE:Undetermined::,"::In order to use the Struts Validator, a form must extend one of the following: ValidatorForm, ValidatorActionForm, DynaValidatorActionForm, and DynaValidatorForm. One of these classes must be extended because the Struts Validator ties in to the application by implementing the validate() method in these classes. Forms derived from the ActionForm and DynaActionForm classes cannot use the Struts Validator.::","","::PHASE:Implementation::","",,"::SCOPE:Other:IMPACT:Other:NOTE:Bypassing the validation framework for a form exposes the application to numerous types of attacks. Unchecked input is an important component of vulnerabilities like cross-site scripting, process control, and SQL injection.::SCOPE:Confidentiality:SCOPE:Integrity:SCOPE:Availability:SCOPE:Other:IMPACT:Other:NOTE:Although J2EE applications are not generally susceptible to memory corruption attacks, if a J2EE application interfaces with native code that does not perform array bounds checking, an attacker may be able to use an input validation mistake in the J2EE application to launch a buffer overflow attack.::","::METHOD:Automated Static Analysis:DESCRIPTION:Automated static analysis, commonly referred to as Static Application Security Testing (SAST), can find some instances of this weakness by analyzing source code (or binary/compiled code) without having to execute it. Typically, this is done by building a model of data flow and control flow, then searching for potentially-vulnerable patterns that connect sources (origins of input) with sinks (destinations where the data interacts with external components, a lower layer such as the OS, etc.):EFFECTIVENESS:High::","::PHASE:Implementation:DESCRIPTION:Ensure that all forms extend one of the Validation Classes.::","",,,"::TAXONOMY NAME:7 Pernicious Kingdoms:ENTRY NAME:Struts: Form Bean Does Not Extend Validation Class::TAXONOMY NAME:Software Fault Patterns:ENTRY ID:SFP24:ENTRY NAME:Tainted input to command::",,"",
105,"Struts: Form Field Without Validator",Variant,Draft,"The product has a form field that is not validated by a corresponding validation form, which can introduce other weaknesses related to insufficient input validation.","Omitting validation for even a single input field may give attackers the leeway they need to compromise the product. Although J2EE applications are not generally susceptible to memory corruption attacks, if a J2EE application interfaces with native code that does not perform array bounds checking, an attacker may be able to use an input validation mistake in the J2EE application to launch a buffer overflow attack.",::NATURE:ChildOf:CWE ID:1173:VIEW ID:1000:ORDINAL:Primary::NATURE:ChildOf:CWE ID:20:VIEW ID:700:ORDINAL:Primary::,"::ORDINALITY:Primary::",::LANGUAGE NAME:Java:LANGUAGE PREVALENCE:Undetermined::,"","","::PHASE:Implementation:NOTE:Some products use the same ActionForm for more than one purpose. In situations like this, some fields may go unused under some action mappings.::","",,"::SCOPE:Integrity:IMPACT:Unexpected State::SCOPE:Integrity:IMPACT:Bypass Protection Mechanism:NOTE:If unused fields are not validated, shared business logic in an action may allow attackers to bypass the validation checks that are performed for other uses of the form.::","","::PHASE:Implementation:DESCRIPTION:Validate all form fields. If a field is unused, it is still important to constrain it so that it is empty or undefined.::","",,,"::TAXONOMY NAME:7 Pernicious Kingdoms:ENTRY NAME:Struts: Form Field Without Validator::TAXONOMY NAME:Software Fault Patterns:ENTRY ID:SFP24:ENTRY NAME:Tainted input to command::",,"",
106,"Struts: Plug-in Framework not in Use",Variant,Draft,"When an application does not use an input validation framework such as the Struts Validator, there is a greater risk of introducing weaknesses related to insufficient input validation.","Unchecked input is the leading cause of vulnerabilities in J2EE applications. Unchecked input leads to cross-site scripting, process control, and SQL injection vulnerabilities, among others. Although J2EE applications are not generally susceptible to memory corruption attacks, if a J2EE application interfaces with native code that does not perform array bounds checking, an attacker may be able to use an input validation mistake in the J2EE application to launch a buffer overflow attack.",::NATURE:ChildOf:CWE ID:1173:VIEW ID:1000:ORDINAL:Primary::NATURE:ChildOf:CWE ID:20:VIEW ID:700:ORDINAL:Primary::,"::ORDINALITY:Primary::",::LANGUAGE NAME:Java:LANGUAGE PREVALENCE:Undetermined::,"","","::PHASE:Implementation::","",,"::SCOPE:Integrity:IMPACT:Unexpected State::","","::PHASE:Architecture and Design:STRATEGY:Input Validation:DESCRIPTION:Use an input validation framework such as Struts.::PHASE:Architecture and Design:STRATEGY:Libraries or Frameworks:DESCRIPTION:Use an input validation framework such as Struts.::PHASE:Implementation:STRATEGY:Input Validation:DESCRIPTION:Use the Struts Validator to validate all program input before it is processed by the application. Ensure that there are no holes in the configuration of the Struts Validator. Example uses of the validator include checking to ensure that: Phone number fields contain only valid characters in phone numbers Boolean values are only T or F Free-form strings are of a reasonable length and composition::PHASE:Implementation:STRATEGY:Libraries or Frameworks:DESCRIPTION:Use the Struts Validator to validate all program input before it is processed by the application. Ensure that there are no holes in the configuration of the Struts Validator. Example uses of the validator include checking to ensure that: Phone number fields contain only valid characters in phone numbers Boolean values are only T or F Free-form strings are of a reasonable length and composition::","",,,"::TAXONOMY NAME:7 Pernicious Kingdoms:ENTRY NAME:Struts: Plug-in Framework Not In Use::",,"",
107,"Struts: Unused Validation Form",Variant,Draft,"An unused validation form indicates that validation logic is not up-to-date.","It is easy for developers to forget to update validation logic when they remove or rename action form mappings. One indication that validation logic is not being properly maintained is the presence of an unused validation form.",::NATURE:ChildOf:CWE ID:1164:VIEW ID:1000:ORDINAL:Primary::NATURE:ChildOf:CWE ID:20:VIEW ID:700:ORDINAL:Primary::,"::ORDINALITY:Resultant::",::LANGUAGE NAME:Java:LANGUAGE PREVALENCE:Undetermined::,"","","::PHASE:Implementation::PHASE:Operation::","",,"::SCOPE:Other:IMPACT:Quality Degradation::","","::PHASE:Implementation:DESCRIPTION:Remove the unused Validation Form from the validation.xml file.::","",,,"::TAXONOMY NAME:7 Pernicious Kingdoms:ENTRY NAME:Struts: Unused Validation Form::",,"",
108,"Struts: Unvalidated Action Form",Variant,Incomplete,"Every Action Form must have a corresponding validation form.","If a Struts Action Form Mapping specifies a form, it must have a validation form defined under the Struts Validator.",::NATURE:ChildOf:CWE ID:1173:VIEW ID:1000:ORDINAL:Primary::NATURE:ChildOf:CWE ID:20:VIEW ID:700:ORDINAL:Primary::,"::ORDINALITY:Primary::",::LANGUAGE NAME:Java:LANGUAGE PREVALENCE:Undetermined::,"","","::PHASE:Implementation::","",,"::SCOPE:Other:IMPACT:Other:NOTE:If an action form mapping does not have a validation form defined, it may be vulnerable to a number of attacks that rely on unchecked input. Unchecked input is the root cause of some of today's worst and most common software security problems. Cross-site scripting, SQL injection, and process control vulnerabilities all stem from incomplete or absent input validation.::SCOPE:Confidentiality:SCOPE:Integrity:SCOPE:Availability:SCOPE:Other:IMPACT:Other:NOTE:Although J2EE applications are not generally susceptible to memory corruption attacks, if a J2EE application interfaces with native code that does not perform array bounds checking, an attacker may be able to use an input validation mistake in the J2EE application to launch a buffer overflow attack.::","","::PHASE:Implementation:STRATEGY:Input Validation:DESCRIPTION:Map every Action Form to a corresponding validation form. An action or a form may perform validation in other ways, but the Struts Validator provides an excellent way to verify that all input receives at least a basic level of validation. Without this approach, it is difficult, and often impossible, to establish with a high level of confidence that all input is validated.::","",,,"::TAXONOMY NAME:7 Pernicious Kingdoms:ENTRY NAME:Struts: Unvalidated Action Form::TAXONOMY NAME:Software Fault Patterns:ENTRY ID:SFP24:ENTRY NAME:Tainted input to command::",,"",
109,"Struts: Validator Turned Off",Variant,Draft,"Automatic filtering via a Struts bean has been turned off, which disables the Struts Validator and custom validation logic. This exposes the application to other weaknesses related to insufficient input validation.","",::NATURE:ChildOf:CWE ID:1173:VIEW ID:1000:ORDINAL:Primary::NATURE:ChildOf:CWE ID:20:VIEW ID:700:ORDINAL:Primary::,"::ORDINALITY:Primary::",::LANGUAGE NAME:Java:LANGUAGE PREVALENCE:Undetermined::,"","","::PHASE:Implementation::","",,"::SCOPE:Access Control:IMPACT:Bypass Protection Mechanism::","","::PHASE:Implementation:DESCRIPTION:Ensure that an action form mapping enables validation. Set the validate field to true.::","",,,"::TAXONOMY NAME:7 Pernicious Kingdoms:ENTRY NAME:Struts: Validator Turned Off::TAXONOMY NAME:Software Fault Patterns:ENTRY ID:SFP24:ENTRY NAME:Tainted input to command::",,"::TYPE:Other:NOTE:The Action Form mapping in the demonstrative example disables the form's validate() method. The Struts bean: write tag automatically encodes special HTML characters, replacing a < with &lt; and a > with &gt;. This action can be disabled by specifying filter=false as an attribute of the tag to disable specified JSP pages. However, being disabled makes these pages susceptible to cross-site scripting attacks. An attacker may be able to insert malicious scripts as user input to write to these JSP pages.::",
110,"Struts: Validator Without Form Field",Variant,Draft,"Validation fields that do not appear in forms they are associated with indicate that the validation logic is out of date.","It is easy for developers to forget to update validation logic when they make changes to an ActionForm class. One indication that validation logic is not being properly maintained is inconsistencies between the action form and the validation form. Although J2EE applications are not generally susceptible to memory corruption attacks, if a J2EE application interfaces with native code that does not perform array bounds checking, an attacker may be able to use an input validation mistake in the J2EE application to launch a buffer overflow attack.",::NATURE:ChildOf:CWE ID:1164:VIEW ID:1000:ORDINAL:Primary::NATURE:ChildOf:CWE ID:20:VIEW ID:700:ORDINAL:Primary::,"::ORDINALITY:Primary::",::LANGUAGE NAME:Java:LANGUAGE PREVALENCE:Undetermined::,"","","::PHASE:Implementation::PHASE:Operation::","",,"::SCOPE:Other:IMPACT:Other:NOTE:It is critically important that validation logic be maintained and kept in sync with the rest of the application. Unchecked input is the root cause of some of today's worst and most common software security problems. Cross-site scripting, SQL injection, and process control vulnerabilities all stem from incomplete or absent input validation.::","::METHOD:Automated Static Analysis:DESCRIPTION:To find the issue in the implementation, manual checks or automated static analysis could be applied to the XML configuration files.:EFFECTIVENESS:Moderate::METHOD:Manual Static Analysis:DESCRIPTION:To find the issue in the implementation, manual checks or automated static analysis could be applied to the XML configuration files.:EFFECTIVENESS:Moderate::","","",,,"::TAXONOMY NAME:7 Pernicious Kingdoms:ENTRY NAME:Struts: Validator Without Form Field::TAXONOMY NAME:Software Fault Patterns:ENTRY ID:SFP24:ENTRY NAME:Tainted input to command::",,"",
111,"Direct Use of Unsafe JNI",Variant,Draft,"When a Java application uses the Java Native Interface (JNI) to call code written in another programming language, it can expose the application to weaknesses in that code, even if those weaknesses cannot occur in Java.","Many safety features that programmers may take for granted do not apply for native code, so you must carefully review all such code for potential problems. The languages used to implement native code may be more susceptible to buffer overflows and other attacks. Native code is unprotected by the security features enforced by the runtime environment, such as strong typing and array bounds checking.",::NATURE:ChildOf:CWE ID:695:VIEW ID:1000:ORDINAL:Primary::NATURE:ChildOf:CWE ID:20:VIEW ID:700:ORDINAL:Primary::,"::ORDINALITY:Primary::",::LANGUAGE NAME:Java:LANGUAGE PREVALENCE:Undetermined::,"","","::PHASE:Implementation::","",,"::SCOPE:Access Control:IMPACT:Bypass Protection Mechanism::","::METHOD:Automated Static Analysis:DESCRIPTION:Automated static analysis, commonly referred to as Static Application Security Testing (SAST), can find some instances of this weakness by analyzing source code (or binary/compiled code) without having to execute it. Typically, this is done by building a model of data flow and control flow, then searching for potentially-vulnerable patterns that connect sources (origins of input) with sinks (destinations where the data interacts with external components, a lower layer such as the OS, etc.):EFFECTIVENESS:High::","::PHASE:Implementation:DESCRIPTION:Implement error handling around the JNI call.::PHASE:Implementation:STRATEGY:Refactoring:DESCRIPTION:Do not use JNI calls if you don't trust the native library.::PHASE:Implementation:STRATEGY:Refactoring:DESCRIPTION:Be reluctant to use JNI calls. A Java API equivalent may exist.::","",,,"::TAXONOMY NAME:7 Pernicious Kingdoms:ENTRY NAME:Unsafe JNI::TAXONOMY NAME:The CERT Oracle Secure Coding Standard for Java (2011):ENTRY ID:SEC08-J:ENTRY NAME:Define wrappers around native methods::TAXONOMY NAME:SEI CERT Oracle Coding Standard for Java:ENTRY ID:JNI01-J:ENTRY NAME:Safely invoke standard APIs that perform tasks using the immediate caller's class loader instance (loadLibrary)::TAXONOMY NAME:SEI CERT Oracle Coding Standard for Java:ENTRY ID:JNI00-J:ENTRY NAME:Define wrappers around native methods:MAPPING FIT:Imprecise::TAXONOMY NAME:Software Fault Patterns:ENTRY ID:SFP3:ENTRY NAME:Use of an improper API::",,"",
112,"Missing XML Validation",Base,Draft,"The product accepts XML from an untrusted source but does not validate the XML against the proper schema.","Most successful attacks begin with a violation of the programmer's assumptions. By accepting an XML document without validating it against a DTD or XML schema, the programmer leaves a door open for attackers to provide unexpected, unreasonable, or malicious input.",::NATURE:ChildOf:CWE ID:1286:VIEW ID:1000:ORDINAL:Primary::NATURE:ChildOf:CWE ID:20:VIEW ID:700:ORDINAL:Primary::,"::ORDINALITY:Primary::",::LANGUAGE CLASS:Not Language-Specific:LANGUAGE PREVALENCE:Undetermined::,"","","::PHASE:Implementation::","",,"::SCOPE:Integrity:IMPACT:Unexpected State::","::METHOD:Automated Static Analysis:DESCRIPTION:Automated static analysis, commonly referred to as Static Application Security Testing (SAST), can find some instances of this weakness by analyzing source code (or binary/compiled code) without having to execute it. Typically, this is done by building a model of data flow and control flow, then searching for potentially-vulnerable patterns that connect sources (origins of input) with sinks (destinations where the data interacts with external components, a lower layer such as the OS, etc.):EFFECTIVENESS:High::","::PHASE:Architecture and Design:STRATEGY:Input Validation:DESCRIPTION:Always validate XML input against a known XML Schema or DTD. It is not possible for an XML parser to validate all aspects of a document's content because a parser cannot understand the complete semantics of the data. However, a parser can do a complete and thorough job of checking the document's structure and therefore guarantee to the code that processes the document that the content is well-formed.::","",,,"::TAXONOMY NAME:7 Pernicious Kingdoms:ENTRY NAME:Missing XML Validation::TAXONOMY NAME:Software Fault Patterns:ENTRY ID:SFP24:ENTRY NAME:Tainted input to command::",::230::231::,"",
