CWE-ID,Name,Weakness Abstraction,Status,Description,Extended Description,Related Weaknesses,Weakness Ordinalities,Applicable Platforms,Background Details,Alternate Terms,Modes Of Introduction,Exploitation Factors,Likelihood of Exploit,Common Consequences,Detection Methods,Potential Mitigations,Observed Examples,Functional Areas,Affected Resources,Taxonomy Mappings,Related Attack Patterns,Notes
190,"Integer Overflow or Wraparound",Base,Stable,"The product performs a calculation that can produce an integer overflow or wraparound, when the logic assumes that the resulting value will always be larger than the original value. This can introduce other weaknesses when the calculation is used for resource management or execution control.","An integer overflow or wraparound occurs when an integer value is incremented to a value that is too large to store in the associated representation. When this occurs, the value may wrap to become a very small or negative number. While this may be intended behavior in circumstances that rely on wrapping, it can have security consequences if the wrap is unexpected. This is especially the case if the integer overflow can be triggered using user-supplied inputs. This becomes security-critical when the result is used to control looping, make a security decision, or determine the offset or size in behaviors such as memory allocation, copying, concatenation, etc.",::NATURE:ChildOf:CWE ID:682:VIEW ID:1000:ORDINAL:Primary::NATURE:ChildOf:CWE ID:682:VIEW ID:1003:ORDINAL:Primary::NATURE:ChildOf:CWE ID:20:VIEW ID:700:ORDINAL:Primary::NATURE:CanPrecede:CWE ID:119:VIEW ID:1000:CHAIN ID:680::,"",::LANGUAGE CLASS:Not Language-Specific:LANGUAGE PREVALENCE:Undetermined::,"","","::PHASE:Implementation::","",,"::SCOPE:Availability:IMPACT:DoS: Crash, Exit, or Restart:IMPACT:DoS: Resource Consumption (CPU):IMPACT:DoS: Resource Consumption (Memory):IMPACT:DoS: Instability:NOTE:This weakness will generally lead to undefined behavior and therefore crashes. In the case of overflows involving loop index variables, the likelihood of infinite loops is also high.::SCOPE:Integrity:IMPACT:Modify Memory:NOTE:If the value in question is important to data (as opposed to flow), simple data corruption has occurred. Also, if the wrap around results in other conditions such as buffer overflows, further memory corruption may occur.::SCOPE:Confidentiality:SCOPE:Availability:SCOPE:Access Control:IMPACT:Execute Unauthorized Code or Commands:IMPACT:Bypass Protection Mechanism:NOTE:This weakness can sometimes trigger buffer overflows which can be used to execute arbitrary code. This is usually outside the scope of a program's implicit security policy.::","::METHOD:Automated Static Analysis:DESCRIPTION:This weakness can often be detected using automated static analysis tools. Many modern tools use data flow analysis or constraint-based techniques to minimize the number of false positives.:EFFECTIVENESS:High::METHOD:Black Box:DESCRIPTION:Sometimes, evidence of this weakness can be detected using dynamic tools and techniques that interact with the product using large test suites with many diverse inputs, such as fuzz testing (fuzzing), robustness testing, and fault injection. The product's operation may slow down, but it should not become unstable, crash, or generate incorrect results.:EFFECTIVENESS:Moderate::METHOD:Manual Analysis:DESCRIPTION:This weakness can be detected using tools and techniques that require manual (human) analysis, such as penetration testing, threat modeling, and interactive tools that allow the tester to record and modify an active session. Specifically, manual static analysis is useful for evaluating the correctness of allocation calculations. This can be useful for detecting overflow conditions (CWE-190) or similar weaknesses that might have serious security impacts on the program.:EFFECTIVENESS:High::METHOD:Automated Static Analysis - Binary or Bytecode:DESCRIPTION:According to SOAR, the following detection techniques may be useful: Highly cost effective: Bytecode Weakness Analysis - including disassembler + source code weakness analysis Binary Weakness Analysis - including disassembler + source code weakness analysis:EFFECTIVENESS:High::METHOD:Dynamic Analysis with Manual Results Interpretation:DESCRIPTION:According to SOAR, the following detection techniques may be useful: Cost effective for partial coverage: Fuzz Tester Framework-based Fuzzer:EFFECTIVENESS:SOAR Partial::METHOD:Manual Static Analysis - Source Code:DESCRIPTION:According to SOAR, the following detection techniques may be useful: Cost effective for partial coverage: Manual Source Code Review (not inspections):EFFECTIVENESS:SOAR Partial::METHOD:Automated Static Analysis - Source Code:DESCRIPTION:According to SOAR, the following detection techniques may be useful: Highly cost effective: Source code Weakness Analyzer Context-configured Source Code Weakness Analyzer:EFFECTIVENESS:High::METHOD:Architecture or Design Review:DESCRIPTION:According to SOAR, the following detection techniques may be useful: Highly cost effective: Formal Methods / Correct-By-Construction Cost effective for partial coverage: Inspection (IEEE 1028 standard) (can apply to requirements, design, source code, etc.):EFFECTIVENESS:High::","::PHASE:Requirements:DESCRIPTION:Ensure that all protocols are strictly defined, such that all out-of-bounds behavior can be identified simply, and require strict conformance to the protocol.::PHASE:Requirements:STRATEGY:Language Selection:DESCRIPTION:Use a language that does not allow this weakness to occur or provides constructs that make this weakness easier to avoid. If possible, choose a language or compiler that performs automatic bounds checking.::PHASE:Architecture and Design:STRATEGY:Libraries or Frameworks:DESCRIPTION:Use a vetted library or framework that does not allow this weakness to occur or provides constructs that make this weakness easier to avoid. Use libraries or frameworks that make it easier to handle numbers without unexpected consequences. Examples include safe integer handling packages such as SafeInt (C++) or IntegerLib (C or C++). [REF-106]::PHASE:Implementation:STRATEGY:Input Validation:DESCRIPTION:Perform input validation on any numeric input by ensuring that it is within the expected range. Enforce that the input meets both the minimum and maximum requirements for the expected range. Use unsigned integers where possible. This makes it easier to perform validation for integer overflows. When signed integers are required, ensure that the range check includes minimum values as well as maximum values.::PHASE:Implementation:DESCRIPTION:Understand the programming language's underlying representation and how it interacts with numeric calculation (CWE-681). Pay close attention to byte size discrepancies, precision, signed/unsigned distinctions, truncation, conversion and casting between types, not-a-number calculations, and how the language handles numbers that are too large or too small for its underlying representation. [REF-7] Also be careful to account for 32-bit, 64-bit, and other potential differences that may affect the numeric representation.::PHASE:Architecture and Design:DESCRIPTION:For any security checks that are performed on the client side, ensure that these checks are duplicated on the server side, in order to avoid CWE-602. Attackers can bypass the client-side checks by modifying values after the checks have been performed, or by changing the client to remove the client-side checks entirely. Then, these modified values would be submitted to the server.::PHASE:Implementation:STRATEGY:Compilation or Build Hardening:DESCRIPTION:Examine compiler warnings closely and eliminate problems with potential security implications, such as signed / unsigned mismatch in memory operations, or use of uninitialized variables. Even if the weakness is rarely exploitable, a single failure may lead to the compromise of the entire system.::","::REFERENCE:CVE-2021-43537:DESCRIPTION:Chain: in a web browser, an unsigned 64-bit integer is forcibly cast to a 32-bit integer (CWE-681) and potentially leading to an integer overflow (CWE-190). If an integer overflow occurs, this can cause heap memory corruption (CWE-122):LINK:https://www.cve.org/CVERecord?id=CVE-2021-43537::REFERENCE:CVE-2022-21668:DESCRIPTION:Chain: Python library does not limit the resources used to process images that specify a very large number of bands (CWE-1284), leading to excessive memory consumption (CWE-789) or an integer overflow (CWE-190).:LINK:https://www.cve.org/CVERecord?id=CVE-2022-21668::REFERENCE:CVE-2022-0545:DESCRIPTION:Chain: 3D renderer has an integer overflow (CWE-190) leading to write-what-where condition (CWE-123) using a crafted image.:LINK:https://www.cve.org/CVERecord?id=CVE-2022-0545::REFERENCE:CVE-2021-30860:DESCRIPTION:Chain: improper input validation (CWE-20) leads to integer overflow (CWE-190) in mobile OS, as exploited in the wild per CISA KEV.:LINK:https://www.cve.org/CVERecord?id=CVE-2021-30860::REFERENCE:CVE-2021-30663:DESCRIPTION:Chain: improper input validation (CWE-20) leads to integer overflow (CWE-190) in mobile OS, as exploited in the wild per CISA KEV.:LINK:https://www.cve.org/CVERecord?id=CVE-2021-30663::REFERENCE:CVE-2018-10887:DESCRIPTION:Chain: unexpected sign extension (CWE-194) leads to integer overflow (CWE-190), causing an out-of-bounds read (CWE-125):LINK:https://www.cve.org/CVERecord?id=CVE-2018-10887::REFERENCE:CVE-2019-1010006:DESCRIPTION:Chain: compiler optimization (CWE-733) removes or modifies code used to detect integer overflow (CWE-190), allowing out-of-bounds write (CWE-787).:LINK:https://www.cve.org/CVERecord?id=CVE-2019-1010006::REFERENCE:CVE-2010-1866:DESCRIPTION:Chain: integer overflow (CWE-190) causes a negative signed value, which later bypasses a maximum-only check (CWE-839), leading to heap-based buffer overflow (CWE-122).:LINK:https://www.cve.org/CVERecord?id=CVE-2010-1866::REFERENCE:CVE-2010-2753:DESCRIPTION:Chain: integer overflow leads to use-after-free:LINK:https://www.cve.org/CVERecord?id=CVE-2010-2753::REFERENCE:CVE-2005-1513:DESCRIPTION:Chain: integer overflow in securely-coded mail program leads to buffer overflow. In 2005, this was regarded as unrealistic to exploit, but in 2020, it was rediscovered to be easier to exploit due to evolutions of the technology.:LINK:https://www.cve.org/CVERecord?id=CVE-2005-1513::REFERENCE:CVE-2002-0391:DESCRIPTION:Integer overflow via a large number of arguments.:LINK:https://www.cve.org/CVERecord?id=CVE-2002-0391::REFERENCE:CVE-2002-0639:DESCRIPTION:Integer overflow in OpenSSH as listed in the demonstrative examples.:LINK:https://www.cve.org/CVERecord?id=CVE-2002-0639::REFERENCE:CVE-2005-1141:DESCRIPTION:Image with large width and height leads to integer overflow.:LINK:https://www.cve.org/CVERecord?id=CVE-2005-1141::REFERENCE:CVE-2005-0102:DESCRIPTION:Length value of -1 leads to allocation of 0 bytes and resultant heap overflow.:LINK:https://www.cve.org/CVERecord?id=CVE-2005-0102::REFERENCE:CVE-2004-2013:DESCRIPTION:Length value of -1 leads to allocation of 0 bytes and resultant heap overflow.:LINK:https://www.cve.org/CVERecord?id=CVE-2004-2013::REFERENCE:CVE-2017-1000121:DESCRIPTION:chain: unchecked message size metadata allows integer overflow (CWE-190) leading to buffer overflow (CWE-119).:LINK:https://www.cve.org/CVERecord?id=CVE-2017-1000121::REFERENCE:CVE-2013-1591:DESCRIPTION:Chain: an integer overflow (CWE-190) in the image size calculation causes an infinite loop (CWE-835) which sequentially allocates buffers without limits (CWE-1325) until the stack is full.:LINK:https://www.cve.org/CVERecord?id=CVE-2013-1591::",::Number Processing::Memory Management::Counters::,,"::TAXONOMY NAME:PLOVER:ENTRY NAME:Integer overflow (wrap or wraparound)::TAXONOMY NAME:7 Pernicious Kingdoms:ENTRY NAME:Integer Overflow::TAXONOMY NAME:CLASP:ENTRY NAME:Integer overflow::TAXONOMY NAME:CERT C Secure Coding:ENTRY ID:INT18-C:ENTRY NAME:Evaluate integer expressions in a larger size before comparing or assigning to that size:MAPPING FIT:CWE More Abstract::TAXONOMY NAME:CERT C Secure Coding:ENTRY ID:INT30-C:ENTRY NAME:Ensure that unsigned integer operations do not wrap:MAPPING FIT:CWE More Abstract::TAXONOMY NAME:CERT C Secure Coding:ENTRY ID:INT32-C:ENTRY NAME:Ensure that operations on signed integers do not result in overflow:MAPPING FIT:Imprecise::TAXONOMY NAME:CERT C Secure Coding:ENTRY ID:INT35-C:ENTRY NAME:Evaluate integer expressions in a larger size before comparing or assigning to that size::TAXONOMY NAME:CERT C Secure Coding:ENTRY ID:MEM07-C:ENTRY NAME:Ensure that the arguments to calloc(), when multiplied, do not wrap:MAPPING FIT:CWE More Abstract::TAXONOMY NAME:CERT C Secure Coding:ENTRY ID:MEM35-C:ENTRY NAME:Allocate sufficient memory for an object::TAXONOMY NAME:WASC:ENTRY ID:3:ENTRY NAME:Integer Overflows::TAXONOMY NAME:Software Fault Patterns:ENTRY ID:SFP1:ENTRY NAME:Glitch in computation::TAXONOMY NAME:ISA/IEC 62443:ENTRY ID:Part 3-3:ENTRY NAME:Req SR 3.5::TAXONOMY NAME:ISA/IEC 62443:ENTRY ID:Part 3-3:ENTRY NAME:Req SR 7.2::TAXONOMY NAME:ISA/IEC 62443:ENTRY ID:Part 4-1:ENTRY NAME:Req SR-2::TAXONOMY NAME:ISA/IEC 62443:ENTRY ID:Part 4-1:ENTRY NAME:Req SI-2::TAXONOMY NAME:ISA/IEC 62443:ENTRY ID:Part 4-1:ENTRY NAME:Req SVV-1::TAXONOMY NAME:ISA/IEC 62443:ENTRY ID:Part 4-1:ENTRY NAME:Req SVV-3::TAXONOMY NAME:ISA/IEC 62443:ENTRY ID:Part 4-2:ENTRY NAME:Req CR 3.5::TAXONOMY NAME:ISA/IEC 62443:ENTRY ID:Part 4-2:ENTRY NAME:Req CR 7.2::",::92::,"::TYPE:Relationship:NOTE:Integer overflows can be primary to buffer overflows.::TYPE:Terminology:NOTE:Integer overflow is sometimes used to cover several types of errors, including signedness errors, or buffer overflows that involve manipulation of integer data types instead of characters. Part of the confusion results from the fact that 0xffffffff is -1 in a signed context. Other confusion also arises because of the role that integer overflows have in chains.::",
242,"Use of Inherently Dangerous Function",Base,Draft,"The product calls a function that can never be guaranteed to work safely.","Certain functions behave in dangerous ways regardless of how they are used. Functions in this category were often implemented without taking security concerns into account. The gets() function is unsafe because it does not perform bounds checking on the size of its input. An attacker can easily send arbitrarily-sized input to gets() and overflow the destination buffer. Similarly, the >> operator is unsafe to use when reading into a statically-allocated character array because it does not perform bounds checking on the size of its input. An attacker can easily send arbitrarily-sized input to the >> operator and overflow the destination buffer.",::NATURE:ChildOf:CWE ID:1177:VIEW ID:1000:ORDINAL:Primary::,"::ORDINALITY:Primary::",::LANGUAGE NAME:C:LANGUAGE PREVALENCE:Undetermined::LANGUAGE NAME:C++:LANGUAGE PREVALENCE:Undetermined::,"","","::PHASE:Implementation::","",,"::SCOPE:Other:IMPACT:Varies by Context::","::METHOD:Automated Static Analysis:DESCRIPTION:Automated static analysis, commonly referred to as Static Application Security Testing (SAST), can find some instances of this weakness by analyzing source code (or binary/compiled code) without having to execute it. Typically, this is done by building a model of data flow and control flow, then searching for potentially-vulnerable patterns that connect sources (origins of input) with sinks (destinations where the data interacts with external components, a lower layer such as the OS, etc.):EFFECTIVENESS:High::","::PHASE:Implementation Requirements:DESCRIPTION:Ban the use of dangerous functions. Use their safe equivalent.::PHASE:Testing:DESCRIPTION:Use grep or static analysis tools to spot usage of dangerous functions.::","::REFERENCE:CVE-2007-4004:DESCRIPTION:FTP client uses inherently insecure gets() function and is setuid root on some systems, allowing buffer overflow:LINK:https://www.cve.org/CVERecord?id=CVE-2007-4004::",,,"::TAXONOMY NAME:7 Pernicious Kingdoms:ENTRY NAME:Dangerous Functions::TAXONOMY NAME:CERT C Secure Coding:ENTRY ID:POS33-C:ENTRY NAME:Do not use vfork():MAPPING FIT:CWE More Abstract::TAXONOMY NAME:Software Fault Patterns:ENTRY ID:SFP3:ENTRY NAME:Use of an improper API::",,"",
243,"Creation of chroot Jail Without Changing Working Directory",Variant,Draft,"The product uses the chroot() system call to create a jail, but does not change the working directory afterward. This does not prevent access to files outside of the jail.","Improper use of chroot() may allow attackers to escape from the chroot jail. The chroot() function call does not change the process's current working directory, so relative paths may still refer to file system resources outside of the chroot jail after chroot() has been called.",::NATURE:ChildOf:CWE ID:573:VIEW ID:1000::NATURE:ChildOf:CWE ID:669:VIEW ID:1000:ORDINAL:Primary::,"::ORDINALITY:Resultant::",::LANGUAGE NAME:C:LANGUAGE PREVALENCE:Undetermined::LANGUAGE NAME:C++:LANGUAGE PREVALENCE:Undetermined::OPERATING SYSTEM CLASS:Unix:OPERATING SYSTEM PREVALENCE:Undetermined::,"::The chroot() system call allows a process to change its perception of the root directory of the file system. After properly invoking chroot(), a process cannot access any files outside the directory tree defined by the new root directory. Such an environment is called a chroot jail and is commonly used to prevent the possibility that a processes could be subverted and used to access unauthorized files. For instance, many FTP servers run in chroot jails to prevent an attacker who discovers a new vulnerability in the server from being able to download the password file or other sensitive files on the system.::","","::PHASE:Implementation:NOTE:REALIZATION: This weakness is caused during implementation of an architectural security tactic.::","",,"::SCOPE:Confidentiality:IMPACT:Read Files or Directories::","::METHOD:Automated Static Analysis:DESCRIPTION:Automated static analysis, commonly referred to as Static Application Security Testing (SAST), can find some instances of this weakness by analyzing source code (or binary/compiled code) without having to execute it. Typically, this is done by building a model of data flow and control flow, then searching for potentially-vulnerable patterns that connect sources (origins of input) with sinks (destinations where the data interacts with external components, a lower layer such as the OS, etc.):EFFECTIVENESS:High::","","",,::File or Directory::,"::TAXONOMY NAME:7 Pernicious Kingdoms:ENTRY NAME:Directory Restriction::TAXONOMY NAME:Software Fault Patterns:ENTRY ID:SFP17:ENTRY NAME:Failed chroot jail::",,"",
244,"Improper Clearing of Heap Memory Before Release ('Heap Inspection')",Variant,Draft,"Using realloc() to resize buffers that store sensitive information can leave the sensitive information exposed to attack, because it is not removed from memory.","When sensitive data such as a password or an encryption key is not removed from memory, it could be exposed to an attacker using a heap inspection attack that reads the sensitive data using memory dumps or other methods. The realloc() function is commonly used to increase the size of a block of allocated memory. This operation often requires copying the contents of the old memory block into a new and larger block. This operation leaves the contents of the original block intact but inaccessible to the program, preventing the program from being able to scrub sensitive data from memory. If an attacker can later examine the contents of a memory dump, the sensitive data could be exposed.",::NATURE:ChildOf:CWE ID:226:VIEW ID:1000:ORDINAL:Primary::NATURE:CanPrecede:CWE ID:669:VIEW ID:1000::,"",::LANGUAGE NAME:C:LANGUAGE PREVALENCE:Undetermined::LANGUAGE NAME:C++:LANGUAGE PREVALENCE:Undetermined::,"","","::PHASE:Implementation::","",,"::SCOPE:Confidentiality:SCOPE:Other:IMPACT:Read Memory:IMPACT:Other:NOTE:Be careful using vfork() and fork() in security sensitive code. The process state will not be cleaned up and will contain traces of data from past use.::","","","::REFERENCE:CVE-2019-3733:DESCRIPTION:Cryptography library does not clear heap memory before release:LINK:https://www.cve.org/CVERecord?id=CVE-2019-3733::",,::Memory::,"::TAXONOMY NAME:7 Pernicious Kingdoms:ENTRY NAME:Heap Inspection::TAXONOMY NAME:CERT C Secure Coding:ENTRY ID:MEM03-C:ENTRY NAME:Clear sensitive information stored in reusable resources returned for reuse::TAXONOMY NAME:Software Fault Patterns:ENTRY ID:SFP23:ENTRY NAME:Exposed Data::",,"",
245,"J2EE Bad Practices: Direct Management of Connections",Variant,Draft,"The J2EE application directly manages connections, instead of using the container's connection management facilities.","The J2EE standard forbids the direct management of connections. It requires that applications use the container's resource management facilities to obtain connections to resources. Every major web application container provides pooled database connection management as part of its resource management framework. Duplicating this functionality in an application is difficult and error prone, which is part of the reason it is forbidden under the J2EE standard.",::NATURE:ChildOf:CWE ID:695:VIEW ID:1000:ORDINAL:Primary::,"::ORDINALITY:Primary::",::LANGUAGE NAME:Java:LANGUAGE PREVALENCE:Undetermined::,"","","::PHASE:Implementation::","",,"::SCOPE:Other:IMPACT:Quality Degradation::","::METHOD:Automated Static Analysis:DESCRIPTION:Automated static analysis, commonly referred to as Static Application Security Testing (SAST), can find some instances of this weakness by analyzing source code (or binary/compiled code) without having to execute it. Typically, this is done by building a model of data flow and control flow, then searching for potentially-vulnerable patterns that connect sources (origins of input) with sinks (destinations where the data interacts with external components, a lower layer such as the OS, etc.):EFFECTIVENESS:High::","","",,,"::TAXONOMY NAME:7 Pernicious Kingdoms:ENTRY NAME:J2EE Bad Practices: getConnection()::TAXONOMY NAME:Software Fault Patterns:ENTRY ID:SFP3:ENTRY NAME:Use of an improper API::",,"",
246,"J2EE Bad Practices: Direct Use of Sockets",Variant,Draft,"The J2EE application directly uses sockets instead of using framework method calls.","The J2EE standard permits the use of sockets only for the purpose of communication with legacy systems when no higher-level protocol is available. Authoring your own communication protocol requires wrestling with difficult security issues. Without significant scrutiny by a security expert, chances are good that a custom communication protocol will suffer from security problems. Many of the same issues apply to a custom implementation of a standard protocol. While there are usually more resources available that address security concerns related to implementing a standard protocol, these resources are also available to attackers.",::NATURE:ChildOf:CWE ID:695:VIEW ID:1000:ORDINAL:Primary::,"::ORDINALITY:Resultant::",::LANGUAGE NAME:Java:LANGUAGE PREVALENCE:Undetermined::,"","","::PHASE:Implementation::","",,"::SCOPE:Other:IMPACT:Quality Degradation::","::METHOD:Automated Static Analysis:DESCRIPTION:Automated static analysis, commonly referred to as Static Application Security Testing (SAST), can find some instances of this weakness by analyzing source code (or binary/compiled code) without having to execute it. Typically, this is done by building a model of data flow and control flow, then searching for potentially-vulnerable patterns that connect sources (origins of input) with sinks (destinations where the data interacts with external components, a lower layer such as the OS, etc.):EFFECTIVENESS:High::","::PHASE:Architecture and Design:DESCRIPTION:Use framework method calls instead of using sockets directly.::","",,,"::TAXONOMY NAME:7 Pernicious Kingdoms:ENTRY NAME:J2EE Bad Practices: Sockets::TAXONOMY NAME:Software Fault Patterns:ENTRY ID:SFP3:ENTRY NAME:Use of an improper API::",,"",
